{
  "$schema": "https://json-schema.org/draft/2020-12/schema",
  "$id": "ads-engine/ads-brief@1",
  "title": "Ads Engine – projekt-brief (brief.json)",
  "description": "A projekt oldalán (pl. https://pacsit.hu/ads/brief.json) kitett leírás: mit hirdessen a motor, kinek, milyen hangon, milyen tényekkel. A JSON-kulcsok angolok, az értékek az ország nyelvén (itt magyarul) vannak.",
  "type": "object",
  "required": ["schema_version", "project", "product", "voice", "landing_pages", "keywords"],
  "additionalProperties": false,
  "properties": {
    "schema_version": {"const": 1, "description": "A séma verziója."},
    "project": {
      "type": "object",
      "required": ["slug", "name", "site", "language", "country"],
      "additionalProperties": false,
      "properties": {
        "slug": {"type": "string", "pattern": "^[a-z0-9-]{2,30}$", "description": "Rövid azonosító, kisbetű (pl. pacsi). Megegyezik a motor projects.toml-jában lévővel."},
        "name": {"type": "string", "minLength": 1, "maxLength": 40, "description": "A termék/márka neve, ahogy a hirdetésekben szerepel."},
        "site": {"type": "string", "pattern": "^https://[^/]+/?$", "description": "A kezdőoldal https-címe (pl. https://pacsit.hu)."},
        "language": {"type": "string", "pattern": "^[a-z]{2}$", "description": "A hirdetések nyelve, kétbetűs kód (hu)."},
        "country": {"type": "string", "pattern": "^[A-Z]{2}$", "description": "A célország kétbetűs kódja (HU). A hirdetés csak itt jelenik meg."}
      }
    },
    "product": {
      "type": "object",
      "required": ["summary", "facts"],
      "additionalProperties": false,
      "properties": {
        "summary": {"type": "string", "minLength": 20, "maxLength": 600, "description": "Mit csinál a termék, kinek, 2–4 mondatban."},
        "offer": {"type": "string", "maxLength": 300, "description": "A fő ajánlat egy mondatban (pl. ingyenes, regisztráció nélküli kvíz)."},
        "audiences": {
          "type": "array", "maxItems": 8,
          "items": {
            "type": "object", "required": ["id", "name"], "additionalProperties": false,
            "properties": {
              "id": {"type": "string", "pattern": "^[a-z0-9_-]{1,30}$"},
              "name": {"type": "string", "maxLength": 80},
              "needs": {"type": "array", "maxItems": 8, "items": {"type": "string", "maxLength": 160}, "description": "Mire van szüksége (a hirdetés ezt szólítja meg)."},
              "search_intents": {"type": "array", "maxItems": 12, "items": {"type": "string", "maxLength": 100}, "description": "Mit keresnek a Google-ben (kulcsszó-ötletek)."}
            }
          }
        },
        "usps": {"type": "array", "maxItems": 10, "items": {"type": "string", "maxLength": 80}, "description": "Rövid előnyök (kiemelések alapja)."},
        "facts": {
          "type": "array", "minItems": 1, "maxItems": 60,
          "description": "Bizonyítható tények. A hirdetésben szereplő minden szám és kényes állítás (ingyenes, regisztráció nélkül, garantált…) csak ezekből jöhet; a motor kódban ellenőrzi.",
          "items": {
            "type": "object", "required": ["id", "text"], "additionalProperties": false,
            "properties": {
              "id": {"type": "string", "pattern": "^[a-z0-9_]{1,40}$"},
              "text": {"type": "string", "minLength": 3, "maxLength": 200, "description": "A tény mondatban."},
              "numbers": {"type": "array", "items": {"type": "string", "pattern": "^[0-9]+([.,][0-9]+)?$"}, "description": "Azok a számok, amelyek a hirdetésben szerepelhetnek (pl. 124, 10)."},
              "tokens": {"type": "array", "items": {"type": "string", "minLength": 2, "maxLength": 40}, "description": "Azok a kényes szavak/kifejezések, amelyeket ez a tény igazol (pl. ingyenes, regisztráció nélkül)."}
            }
          }
        }
      }
    },
    "voice": {
      "type": "object", "required": ["tone"], "additionalProperties": false,
      "properties": {
        "tone": {"type": "string", "maxLength": 300, "description": "Hangnem (pl. barátságos, könnyed, tegező)."},
        "avoid": {"type": "array", "maxItems": 20, "items": {"type": "string", "maxLength": 160}, "description": "Mit kerüljön a szöveg (stílus)."},
        "forbidden_words": {"type": "array", "maxItems": 100, "items": {"type": "string", "minLength": 2, "maxLength": 40}, "description": "Tiltott szavak a hirdetésszövegekben (ékezet- és kisbetű-függetlenül ellenőrizzük)."},
        "forbidden_claims": {"type": "array", "maxItems": 30, "items": {"type": "string", "maxLength": 200}, "description": "Tiltott állítások (szabad szöveg, az AI-szövegíró ezt kapja; a kódos ellenőrzés a forbidden_words-ön fut)."}
      }
    },
    "compliance": {
      "type": "object", "additionalProperties": false,
      "properties": {
        "category": {"enum": ["none", "regulated"], "description": "regulated: szabályozott terület (pénzügy, egészség, gyógyszer, szerencsejáték, politika…): ilyenkor a motor csak emberi jóváhagyással ír."},
        "notes": {"type": "string", "maxLength": 600}
      }
    },
    "landing_pages": {
      "type": "array", "minItems": 1, "maxItems": 20,
      "items": {
        "type": "object", "required": ["id", "url", "purpose"], "additionalProperties": false,
        "properties": {
          "id": {"type": "string", "pattern": "^[a-z0-9_-]{1,30}$"},
          "url": {"type": "string", "pattern": "^https://", "description": "A végső URL UTM nélkül; a motor a kampányon ad hozzá követő paramétereket. A lekérdezés-szöveg (?utm_…) átmegy az átirányításokon (a validátor ellenőrzi)."},
          "purpose": {"type": "string", "maxLength": 160, "description": "Mire való az oldal, milyen szándékú keresőnek jó."}
        }
      }
    },
    "keywords": {
      "type": "object", "required": ["core"], "additionalProperties": false,
      "properties": {
        "core": {"type": "array", "minItems": 1, "maxItems": 30, "items": {"type": "string", "minLength": 2, "maxLength": 80}, "description": "Magkifejezések: a motor ezeket soha nem zárja ki negatívként, és az új kulcsszavaknak ezekhez közel kell lenniük."},
        "negatives": {"type": "array", "maxItems": 500, "items": {"type": "string", "minLength": 2, "maxLength": 80}, "description": "Kezdő negatív kulcsszavak (kifejezés típusú)."},
        "competitor_brands": {"type": "array", "maxItems": 50, "items": {"type": "string", "maxLength": 60}, "description": "Versenytárs-márkanevek: a motor nem használja őket (kulcsszóban sem)."}
      }
    },
    "tracking": {
      "type": "object", "additionalProperties": false,
      "properties": {
        "umami_website_id": {"type": "string", "maxLength": 64},
        "visit_event": {"type": "string", "maxLength": 50, "description": "Az az esemény, ami látogatásonként egyszer tüzel (alap: inditas). Ebből számolja a motor a hirdetésekből jövő látogatásokat."},
        "engaged_events": {"type": "array", "maxItems": 20, "items": {"type": "string", "maxLength": 50}, "description": "Az az esemény, ami „bevont látogatást” jelent (oldalbetöltésenként egyszer; Pacsi: bevont)."},
        "key_events": {"type": "array", "maxItems": 20, "items": {"type": "string", "maxLength": 50}, "description": "A legfontosabb cselekvések (Pacsi: kviz-kesz, kartya)."}
      }
    },
    "ads": {
      "type": "object", "additionalProperties": false,
      "properties": {
        "max_cpc": {"type": "number", "minimum": 1, "description": "A kattintásonkénti költség plafonja a fiók pénznemében (Maximize clicks mellett)."},
        "business_name": {"type": "string", "maxLength": 25, "description": "Cégnév a hirdetésekben (Demand Gen)."}
      }
    },
    "brand": {
      "type": "object", "additionalProperties": false,
      "properties": {
        "colors": {"type": "object", "additionalProperties": {"type": "string", "pattern": "^#[0-9a-fA-F]{6}$"}, "description": "Arculati színek (pl. primary, background, text)."},
        "fonts": {"type": "array", "maxItems": 4, "items": {"type": "string", "maxLength": 60}},
        "logo": {"type": "string", "maxLength": 300, "description": "A logó fájlja (relatív a brief-hez vagy abszolút https)."},
        "image_style_prompt": {"type": "string", "maxLength": 1500, "description": "Képstílus-leírás az AI-képgeneráláshoz (angolul is jó)."},
        "reference_images": {"type": "array", "maxItems": 10, "items": {"type": "string", "maxLength": 300}}
      }
    },
    "seasonality": {
      "type": "array", "maxItems": 12,
      "items": {
        "type": "object", "required": ["month", "themes"], "additionalProperties": false,
        "properties": {
          "month": {"type": "integer", "minimum": 1, "maximum": 12},
          "themes": {"type": "array", "maxItems": 8, "items": {"type": "string", "maxLength": 80}}
        }
      }
    },
    "creatives_url": {"type": "string", "maxLength": 300, "description": "A kész hirdetések (creatives.json) helye; relatív a brief-hez vagy abszolút https. Ha nincs, a motor maga ír szöveget a briefből."}
  }
}
